Vulnerability name ,Description,Impact,Severity,Steps,Fix,Cvss,Cvss_String,Cwe,Type
CIFS Port Exposed To Internet,"The Common Internet File System (CIFS) is a network file sharing protocol used to provide shared access to files and printers over a network. CIFS operates over the Server Message Block (SMB) protocol. If CIFS ports (typically port 445) are exposed to the internet, it can create significant security risks, including unauthorized access to file shares, data breaches, and system compromise. <p class=""pt-2"">Exposing CIFS ports directly to the internet increases the attack surface, making systems vulnerable to various threats, including exploitation of known vulnerabilities, unauthorized access, and denial-of-service (DoS) attacks.</p>","<ul class=""list-disc pl-4""><li><strong>Unauthorized Access:</strong> Exposed CIFS ports can allow attackers to gain unauthorized access to file shares and sensitive data, potentially leading to data breaches and loss of confidentiality.</li><li><strong>Data Breaches:</strong> Attackers may exploit exposed ports to access, exfiltrate, or manipulate sensitive information stored on file shares, leading to potential data breaches.</li><li><strong>Denial-of-Service (DoS) Attacks:</strong> Publicly accessible CIFS ports can be targeted with DoS attacks, which may disrupt file sharing operations and degrade performance.</li><li><strong>Exploitation of Vulnerabilities:</strong> Exposed CIFS ports increase the risk of exploiting known vulnerabilities in the CIFS/SMB protocol, which can lead to system compromise or unauthorized control.</li></ul>",HIGH,,"<ul class=""list-disc pl-4""><li><strong>Restrict Access:</strong> Use firewalls, security groups, and network access control lists (NACLs) to restrict access to CIFS ports. Ensure that only trusted IP addresses or networks can access these ports.</li><li><strong>Use VPN or Private Network:</strong> Deploy CIFS services within a private network or VPN to restrict access to internal communication only. Avoid exposing CIFS ports to the public internet.</li><li><strong>Implement Authentication and Encryption:</strong> Enable authentication mechanisms and encryption for CIFS/SMB communications to protect data and prevent unauthorized access.</li><li><strong>Regularly Update and Patch:</strong> Keep CIFS/SMB services and their dependencies up-to-date with the latest security patches and updates to address known vulnerabilities.</li><li><strong>Monitor and Audit:</strong> Implement monitoring and logging to detect unauthorized access attempts or unusual activity on CIFS ports. Use tools like AWS CloudTrail, CloudWatch, or similar services for auditing and alerting.</li><li><strong>Review Security Configurations:</strong> Regularly review and update security configurations for CIFS/SMB services to align with best practices and security standards.</li></ul>",8.1,AV:N/AC:L/PR:L/UI:N/S:U/C:H/I:H/A:H,CWE-200: Information Exposure,cloud
FTP Port Exposed To Internet,"File Transfer Protocol (FTP) is a standard network protocol used to transfer files between a client and a server. FTP operates over ports 21 (command) and 20 (data). If these ports are exposed to the internet, it can create significant security risks. Exposing FTP ports directly to the internet can lead to unauthorized access, data breaches, and potential system compromise. <p class=""pt-2"">FTP is inherently insecure because it transmits data, including credentials, in plaintext. When FTP ports are accessible from the internet, attackers can exploit vulnerabilities, perform brute-force attacks, and access or manipulate sensitive files.</p>","<ul class=""list-disc pl-4""><li><strong>Unauthorized Access:</strong> Exposed FTP ports can allow attackers to gain unauthorized access to file systems, potentially compromising sensitive data and system integrity.</li><li><strong>Data Breaches:</strong> Attackers may exploit exposed ports to access, exfiltrate, or manipulate files, leading to data breaches and loss of confidentiality.</li><li><strong>Exploitation of Vulnerabilities:</strong> Exposed FTP ports increase the risk of exploiting known vulnerabilities in the FTP protocol or its implementations, leading to potential system compromise.</li><li><strong>Denial-of-Service (DoS) Attacks:</strong> Publicly accessible FTP ports can be targeted with DoS attacks, which may disrupt file transfer operations and degrade performance.</li></ul>",HIGH,,"<ul class=""list-disc pl-4""><li><strong>Restrict Access:</strong> Use firewalls, security groups, and network access control lists (NACLs) to restrict access to FTP ports. Ensure that only trusted IP addresses or networks can access these ports.</li><li><strong>Use Secure Alternatives:</strong> Replace FTP with more secure protocols such as SFTP (SSH File Transfer Protocol) or FTPS (FTP Secure), which provide encryption for data in transit and authentication.</li><li><strong>Implement Authentication and Encryption:</strong> If FTP must be used, implement authentication mechanisms and encryption (e.g., FTP over TLS/SSL) to protect data and prevent unauthorized access.</li><li><strong>Regularly Update and Patch:</strong> Keep FTP servers and their dependencies up-to-date with the latest security patches and updates to address known vulnerabilities.</li><li><strong>Monitor and Audit:</strong> Implement monitoring and logging to detect unauthorized access attempts or unusual activity on FTP ports. Use tools like AWS CloudTrail, CloudWatch, or similar services for auditing and alerting.</li><li><strong>Review Security Configurations:</strong> Regularly review and update security configurations for FTP services to align with best practices and security standards.</li></ul>",8.1,AV:N/AC:L/PR:L/UI:N/S:U/C:H/I:H/A:H,CWE-200: Information Exposure,cloud
Kafka Port Exposed To Internet,"Apache Kafka is a distributed event streaming platform used for building real-time data pipelines and streaming applications. Kafka operates on ports such as 9092 for client connections. If Kafka ports are exposed to the internet, it can pose significant security risks, including unauthorized access to Kafka topics, data breaches, and system compromise. <p class=""pt-2"">Exposing Kafka ports directly to the internet increases the risk of attacks on the Kafka brokers, allowing unauthorized users to access, modify, or consume data streams.</p>","<ul class=""list-disc pl-4""><li><strong>Unauthorized Access:</strong> Exposed Kafka ports can allow attackers to gain unauthorized access to Kafka brokers and topics, potentially compromising data confidentiality and integrity.</li><li><strong>Data Breaches:</strong> Attackers may exploit exposed Kafka ports to access, exfiltrate, or manipulate sensitive data streams, leading to data breaches and loss of confidentiality.</li><li><strong>Exploitation of Vulnerabilities:</strong> Exposed Kafka ports increase the risk of exploiting known vulnerabilities in the Kafka protocol or its implementations, leading to potential system compromise.</li><li><strong>Denial-of-Service (DoS) Attacks:</strong> Publicly accessible Kafka ports can be targeted with DoS attacks, which may disrupt data streaming operations and degrade performance.</li></ul>",HIGH,,"<ul class=""list-disc pl-4""><li><strong>Restrict Access:</strong> Use firewalls, security groups, and network access control lists (NACLs) to restrict access to Kafka ports. Ensure that only trusted IP addresses or networks can access these ports.</li><li><strong>Use Encryption:</strong> Enable encryption for data in transit by configuring SSL/TLS for Kafka brokers and clients. This ensures that data exchanged between Kafka clients and brokers is secure.</li><li><strong>Implement Authentication and Authorization:</strong> Use Kafka’s built-in authentication mechanisms (e.g., SASL) and access control lists (ACLs) to restrict access to Kafka brokers and topics based on user roles.</li><li><strong>Regularly Update and Patch:</strong> Keep Kafka brokers and their dependencies up-to-date with the latest security patches and updates to address known vulnerabilities.</li><li><strong>Monitor and Audit:</strong> Implement monitoring and logging to detect unauthorized access attempts or unusual activity on Kafka ports. Use tools like Kafka’s internal monitoring features, AWS CloudWatch, or similar services for auditing and alerting.</li><li><strong>Review Security Configurations:</strong> Regularly review and update security configurations for Kafka services to align with best practices and security standards.</li></ul>",8.1,AV:N/AC:L/PR:L/UI:N/S:U/C:H/I:H/A:H,CWE-200: Information Exposure,cloud
Kerberos Port Exposed To Internet,"Kerberos is a network authentication protocol designed to provide strong authentication for client-server applications through secret-key cryptography. It typically operates on ports 88 (Kerberos authentication) and 464 (Kerberos password change). If these ports are exposed to the internet, it poses significant security risks, including unauthorized access, credential theft, and potential system compromise. <p class=""pt-2"">Exposing Kerberos ports to the internet increases the risk of attacks on the Kerberos Key Distribution Center (KDC), allowing unauthorized users to attempt brute-force attacks, exploit vulnerabilities, or gain unauthorized access to network resources.</p>","<ul class=""list-disc pl-4""><li><strong>Unauthorized Access:</strong> Exposed Kerberos ports can allow attackers to gain unauthorized access to the Kerberos authentication service, potentially compromising network security.</li><li><strong>Credential Theft:</strong> Attackers may exploit exposed Kerberos ports to capture or crack Kerberos tickets and passwords, leading to credential theft and unauthorized access to systems.</li><li><strong>Exploitation of Vulnerabilities:</strong> Exposed Kerberos ports increase the risk of exploiting known vulnerabilities in the Kerberos protocol or its implementations, leading to potential system compromise.</li><li><strong>Denial-of-Service (DoS) Attacks:</strong> Publicly accessible Kerberos ports can be targeted with DoS attacks, which may disrupt authentication services and degrade performance.</li></ul>",HIGH,,"<ul class=""list-disc pl-4""><li><strong>Restrict Access:</strong> Use firewalls, security groups, and network access control lists (NACLs) to restrict access to Kerberos ports. Ensure that only trusted IP addresses or networks can access these ports.</li><li><strong>Use Secure Alternatives:</strong> Where possible, avoid exposing Kerberos ports to the internet and use VPNs or other secure methods for remote access to authentication services.</li><li><strong>Implement Strong Authentication Mechanisms:</strong> Use strong authentication methods, such as multi-factor authentication (MFA), to protect access to Kerberos services.</li><li><strong>Regularly Update and Patch:</strong> Keep Kerberos servers and their dependencies up-to-date with the latest security patches and updates to address known vulnerabilities.</li><li><strong>Monitor and Audit:</strong> Implement monitoring and logging to detect unauthorized access attempts or unusual activity on Kerberos ports. Use tools like AWS CloudTrail, CloudWatch, or similar services for auditing and alerting.</li><li><strong>Review Security Configurations:</strong> Regularly review and update security configurations for Kerberos services to align with best practices and security standards.</li></ul>",8.1,AV:N/AC:L/PR:L/UI:N/S:U/C:H/I:H/A:H,CWE-200: Information Exposure,cloud
LDAP Port Exposed To Internet,"The Lightweight Directory Access Protocol (LDAP) is used for accessing and managing directory services over a network. LDAP typically operates on ports 389 (LDAP) and 636 (LDAPS for secure LDAP). If these ports are exposed to the internet, it can pose significant security risks, including unauthorized access to directory information, credential theft, and potential system compromise. <p class=""pt-2"">Exposing LDAP ports to the internet increases the risk of attacks on the LDAP server, allowing unauthorized users to attempt brute-force attacks, exploit vulnerabilities, or gain unauthorized access to directory data.</p>","<ul class=""list-disc pl-4""><li><strong>Unauthorized Access:</strong> Exposed LDAP ports can allow attackers to gain unauthorized access to the LDAP directory service, potentially compromising sensitive directory information.</li><li><strong>Credential Theft:</strong> Attackers may exploit exposed LDAP ports to capture or crack LDAP credentials and authentication tokens, leading to credential theft and unauthorized access.</li><li><strong>Exploitation of Vulnerabilities:</strong> Exposed LDAP ports increase the risk of exploiting known vulnerabilities in the LDAP protocol or its implementations, leading to potential system compromise.</li><li><strong>Denial-of-Service (DoS) Attacks:</strong> Publicly accessible LDAP ports can be targeted with DoS attacks, which may disrupt directory services and degrade performance.</li></ul>",HIGH,,"<ul class=""list-disc pl-4""><li><strong>Restrict Access:</strong> Use firewalls, security groups, and network access control lists (NACLs) to restrict access to LDAP ports. Ensure that only trusted IP addresses or networks can access these ports.</li><li><strong>Use Encryption:</strong> Enable encryption for LDAP traffic by configuring LDAPS (LDAP over SSL/TLS) to secure data in transit. This ensures that data exchanged between LDAP clients and servers is encrypted.</li><li><strong>Implement Strong Authentication and Authorization:</strong> Use strong authentication methods, such as multi-factor authentication (MFA), and configure access controls to restrict access to LDAP services based on user roles.</li><li><strong>Regularly Update and Patch:</strong> Keep LDAP servers and their dependencies up-to-date with the latest security patches and updates to address known vulnerabilities.</li><li><strong>Monitor and Audit:</strong> Implement monitoring and logging to detect unauthorized access attempts or unusual activity on LDAP ports. Use tools like AWS CloudTrail, CloudWatch, or similar services for auditing and alerting.</li><li><strong>Review Security Configurations:</strong> Regularly review and update security configurations for LDAP services to align with best practices and security standards.</li></ul>",8.1,AV:N/AC:L/PR:L/UI:N/S:U/C:H/I:H/A:H,CWE-200: Information Exposure,cloud
MongoDB Port Exposed To Internet,"MongoDB is a NoSQL database that uses ports 27017 (default) for client connections. If this port is exposed to the internet, it poses significant security risks, including unauthorized access to database contents, data manipulation, and potential system compromise. Exposing MongoDB ports to the internet can lead to a range of vulnerabilities and exploitation scenarios. <p class=""pt-2"">Exposing MongoDB to the internet increases the risk of attackers accessing, modifying, or deleting data, as well as launching attacks on the database system itself.</p>","<ul class=""list-disc pl-4""><li><strong>Unauthorized Access:</strong> Exposed MongoDB ports can allow attackers to gain unauthorized access to the database, potentially compromising sensitive data and application integrity.</li><li><strong>Data Manipulation:</strong> Attackers may exploit exposed MongoDB ports to manipulate or corrupt data, leading to data integrity issues and potential data loss.</li><li><strong>Exploitation of Vulnerabilities:</strong> Exposed MongoDB ports increase the risk of exploiting known vulnerabilities in MongoDB or its implementations, which can lead to system compromise or unauthorized access.</li><li><strong>Denial-of-Service (DoS) Attacks:</strong> Publicly accessible MongoDB ports can be targeted with DoS attacks, which may disrupt database services and degrade performance.</li></ul>",HIGH,,"<ul class=""list-disc pl-4""><li><strong>Restrict Access:</strong> Use firewalls, security groups, and network access control lists (NACLs) to restrict access to MongoDB ports. Ensure that only trusted IP addresses or networks can access these ports.</li><li><strong>Enable Authentication:</strong> Configure MongoDB to require authentication for all database access. Implement strong authentication methods, such as multi-factor authentication (MFA), to protect database access.</li><li><strong>Use Encryption:</strong> Enable encryption for data in transit (TLS/SSL) and at rest to protect sensitive data. MongoDB supports encryption to secure data both in transit and at rest.</li><li><strong>Regularly Update and Patch:</strong> Keep MongoDB and its dependencies up-to-date with the latest security patches and updates to address known vulnerabilities.</li><li><strong>Implement Access Controls:</strong> Use role-based access controls (RBAC) to restrict permissions and access to database resources based on user roles and responsibilities.</li><li><strong>Monitor and Audit:</strong> Implement monitoring and logging to detect unauthorized access attempts or unusual activity on MongoDB ports. Use tools like AWS CloudTrail, CloudWatch, or similar services for auditing and alerting.</li><li><strong>Review Security Configurations:</strong> Regularly review and update security configurations for MongoDB to align with best practices and security standards.</li></ul>",8.1,AV:N/AC:L/PR:L/UI:N/S:U/C:H/I:H/A:H,CWE-200: Information Exposure,cloud
MySQL Port Exposed To Internet,"MySQL is a widely-used relational database management system that typically operates on port 3306. When this port is exposed to the internet, it poses significant security risks, including unauthorized access to database contents, data manipulation, and potential system compromise. Exposing MySQL ports to the internet increases the risk of attackers accessing, modifying, or deleting data, as well as launching attacks on the database system itself.","<ul class=""list-disc pl-4""><li><strong>Unauthorized Access:</strong> Exposed MySQL ports can allow attackers to gain unauthorized access to the database, potentially compromising sensitive data and application integrity.</li><li><strong>Data Manipulation:</strong> Attackers may exploit exposed MySQL ports to manipulate or corrupt data, leading to data integrity issues and potential data loss.</li><li><strong>Exploitation of Vulnerabilities:</strong> Exposed MySQL ports increase the risk of exploiting known vulnerabilities in MySQL or its implementations, which can lead to system compromise or unauthorized access.</li><li><strong>Denial-of-Service (DoS) Attacks:</strong> Publicly accessible MySQL ports can be targeted with DoS attacks, which may disrupt database services and degrade performance.</li><li><strong>Compliance Issues:</strong> Many security standards and best practices require databases to be protected from unauthorized internet access. Exposing MySQL ports may result in non-compliance with these regulations.</li></ul>",HIGH,,"<ul class=""list-disc pl-4""><li><strong>Restrict Access:</strong> Use firewalls, security groups, and network access control lists (NACLs) to restrict access to MySQL ports. Ensure that only trusted IP addresses or networks can access these ports.</li><li><strong>Enable Authentication:</strong> Configure MySQL to require authentication for all database access. Implement strong authentication methods, such as multi-factor authentication (MFA), to protect database access.</li><li><strong>Use Encryption:</strong> Enable encryption for data in transit (TLS/SSL) and at rest to protect sensitive data. MySQL supports encryption to secure data both in transit and at rest.</li><li><strong>Regularly Update and Patch:</strong> Keep MySQL and its dependencies up-to-date with the latest security patches and updates to address known vulnerabilities.</li><li><strong>Implement Access Controls:</strong> Use MySQL’s built-in access control mechanisms to restrict permissions and access to database resources based on user roles and responsibilities.</li><li><strong>Monitor and Audit:</strong> Implement monitoring and logging to detect unauthorized access attempts or unusual activity on MySQL ports. Use tools like AWS CloudTrail, CloudWatch, or similar services for auditing and alerting.</li><li><strong>Review Security Configurations:</strong> Regularly review and update security configurations for MySQL to align with best practices and security standards.</li></ul>",8.1,AV:N/AC:L/PR:L/UI:N/S:U/C:H/I:H/A:H,CWE-200: Information Exposure,cloud
Oracle Port Exposed To Internet,"Oracle Database uses various ports, commonly port 1521 for client connections. If this port is exposed to the internet, it poses significant security risks, including unauthorized access to database contents, data manipulation, and potential system compromise. Exposing Oracle Database ports to the internet increases the risk of attackers accessing, modifying, or deleting data, as well as launching attacks on the database system itself.","<ul class=""list-disc pl-4""><li><strong>Unauthorized Access:</strong> Exposed Oracle ports can allow attackers to gain unauthorized access to the database, potentially compromising sensitive data and application integrity.</li><li><strong>Data Manipulation:</strong> Attackers may exploit exposed Oracle ports to manipulate or corrupt data, leading to data integrity issues and potential data loss.</li><li><strong>Exploitation of Vulnerabilities:</strong> Exposed Oracle ports increase the risk of exploiting known vulnerabilities in Oracle Database or its configurations, which can lead to system compromise or unauthorized access.</li><li><strong>Denial-of-Service (DoS) Attacks:</strong> Publicly accessible Oracle ports can be targeted with DoS attacks, which may disrupt database services and degrade performance.</li></ul>",HIGH,,"<ul class=""list-disc pl-4""><li><strong>Restrict Access:</strong> Use firewalls, security groups, and network access control lists (NACLs) to restrict access to Oracle Database ports. Ensure that only trusted IP addresses or networks can access these ports.</li><li><strong>Enable Authentication:</strong> Configure Oracle Database to require strong authentication for all database access. Implement strong authentication methods, such as multi-factor authentication (MFA), to protect database access.</li><li><strong>Use Encryption:</strong> Enable encryption for data in transit (TLS/SSL) and at rest to protect sensitive data. Oracle Database supports encryption to secure data both in transit and at rest.</li><li><strong>Regularly Update and Patch:</strong> Keep Oracle Database and its dependencies up-to-date with the latest security patches and updates to address known vulnerabilities.</li><li><strong>Implement Access Controls:</strong> Use Oracle Database’s built-in access control mechanisms to restrict permissions and access to database resources based on user roles and responsibilities.</li><li><strong>Monitor and Audit:</strong> Implement monitoring and logging to detect unauthorized access attempts or unusual activity on Oracle ports. Use tools like AWS CloudTrail, CloudWatch, or similar services for auditing and alerting.</li><li><strong>Review Security Configurations:</strong> Regularly review and update security configurations for Oracle Database to align with best practices and security standards.</li></ul>",8.1,AV:N/AC:L/PR:L/UI:N/S:U/C:H/I:H/A:H,CWE-200: Information Exposure,cloud
