Vulnerability name ,Description,Impact,Severity,Steps,Fix,Cvss,Cvss_String,Cwe,Type
Enable Model Invocation Logging,"This vulnerability occurs when model invocation logging is not enabled in AWS SageMaker. Model invocation logging provides visibility into the usage of deployed machine learning models, including details about the requests made to the model, the responses generated, and any errors encountered. Without this logging, there is no record of model interactions, which can hinder debugging, monitoring, and auditing processes. <p class=""pt-2"">Model invocation logging is crucial for understanding how models are used in production, identifying performance bottlenecks, and detecting potential misuse or anomalies. Without logs, issues such as incorrect model behavior or performance degradation may go unnoticed, and compliance with auditing or regulatory requirements could be compromised.</p>","<ul class=""list-disc pl-4""><li><strong>Delayed Response to Issues:</strong> Without notifications, administrators might not be immediately aware of critical scaling events, leading to delayed responses to operational issues, such as insufficient capacity or unexpected instance terminations.</li><li><strong>Service Disruptions:</strong> A lack of timely information can result in service disruptions, as scaling events might go unnoticed, leading to either under-provisioned or over-provisioned resources, which can affect application performance and availability.</li><li><strong>Operational Inefficiencies:</strong> Inability to monitor scaling activities can lead to inefficient resource usage, such as maintaining too many or too few instances, impacting both cost and performance.</li></ul>",MEDIUM,,"<ul class=""list-disc pl-4""><li><strong>Enable Model Invocation Logging:</strong> Configure AWS SageMaker to enable logging for model invocations. This can be done by setting up logging to Amazon CloudWatch Logs or an S3 bucket, depending on your requirements.</li><li><strong>Configure Log Retention and Access:</strong> Set up log retention policies to ensure that invocation logs are kept for an appropriate duration based on your organization's needs and compliance requirements. Restrict access to logs to authorized personnel only.</li><li><strong>Monitor and Analyze Logs:</strong> Regularly review and analyze invocation logs to monitor the model's performance, detect anomalies, and gain insights into usage patterns. Use CloudWatch Insights or other log analysis tools to automate this process where possible.</li><li><strong>Integrate with Security Tools:</strong> Integrate logging with security information and event management (SIEM) tools to enhance the detection of potential security incidents or misuse.</li><li><strong>Set Up Alerts for Anomalies:</strong> Configure CloudWatch Alarms or other monitoring tools to alert you of unusual patterns or errors in the invocation logs, enabling prompt investigation and response.</li></ul>",6.8,AV:N/AC:L/PR:L/UI:N/S:U/C:H/I:H/A:L,CWE-778: Insufficient Logging,cloud
Use Customer-Managed Keys to Encrypt Amazon Bedrock Guardrails,"This vulnerability occurs when Amazon Bedrock guardrails are not encrypted with customer-managed keys. Amazon Bedrock is a service for building and managing machine learning models and their associated resources. Guardrails in this context refer to the policies and configurations that help ensure the proper use and management of the machine learning models. <p class=""pt-2"">By default, Amazon Bedrock provides encryption using AWS-managed keys, but it is generally recommended to use customer-managed keys (CMKs) for enhanced control over encryption. Customer-managed keys offer greater flexibility and control over key policies, access, and lifecycle management, allowing you to align with organizational security and compliance requirements.</p>","<ul class=""list-disc pl-4""><li><strong>Delayed Response to Issues:</strong> Without notifications, administrators might not be immediately aware of critical scaling events, leading to delayed responses to operational issues, such as insufficient capacity or unexpected instance terminations.</li><li><strong>Service Disruptions:</strong> A lack of timely information can result in service disruptions, as scaling events might go unnoticed, leading to either under-provisioned or over-provisioned resources, which can affect application performance and availability.</li><li><strong>Operational Inefficiencies:</strong> Inability to monitor scaling activities can lead to inefficient resource usage, such as maintaining too many or too few instances, impacting both cost and performance.</li></ul>",HIGH,,"<ul class=""list-disc pl-4""><li><strong>Enable Customer-Managed Keys (CMKs):</strong> Configure Amazon Bedrock to use customer-managed keys for encrypting guardrails. This can be done by specifying the CMK in the encryption settings of your Bedrock resources.</li><li><strong>Set Up Key Policies and Access Controls:</strong> Define and enforce key policies and access controls for your CMKs to ensure that only authorized users and services have access to the keys.</li><li><strong>Implement Key Rotation Policies:</strong> Set up automatic key rotation for your CMKs to enhance security. Regularly rotating keys reduces the risk of key compromise and ensures that encryption remains effective over time.</li><li><strong>Monitor Key Usage and Access:</strong> Use AWS CloudTrail and AWS Key Management Service (KMS) logs to monitor the usage and access of your CMKs. Regularly review these logs to detect any unauthorized access or anomalies.</li><li><strong>Review Compliance Requirements:</strong> Ensure that the use of CMKs aligns with your organization's compliance requirements and security policies. Adjust key management practices as needed to meet regulatory standards.</li></ul>",7.2,AV:N/AC:L/PR:L/UI:N/S:U/C:H/I:H/A:N,CWE-310: Cryptographic Issues,cloud
Use Customer-Managed Keys to Encrypt Custom Models,"This vulnerability arises when custom models in Amazon SageMaker are not encrypted using customer-managed keys (CMKs). Custom models refer to machine learning models that you have trained or developed yourself and deployed in AWS SageMaker. By default, Amazon SageMaker uses AWS-managed keys for encryption, but using CMKs provides greater control and security over the encryption process. <p class=""pt-2"">Customer-managed keys offer more granular control over key policies, access, and lifecycle management compared to AWS-managed keys. Without CMKs, the encryption of your custom models relies on AWS-managed keys, which may not align with your organization’s security policies or compliance requirements.</p>","<ul class=""list-disc pl-4""><li><strong>Delayed Response to Issues:</strong> Without notifications, administrators might not be immediately aware of critical scaling events, leading to delayed responses to operational issues, such as insufficient capacity or unexpected instance terminations.</li><li><strong>Service Disruptions:</strong> A lack of timely information can result in service disruptions, as scaling events might go unnoticed, leading to either under-provisioned or over-provisioned resources, which can affect application performance and availability.</li><li><strong>Operational Inefficiencies:</strong> Inability to monitor scaling activities can lead to inefficient resource usage, such as maintaining too many or too few instances, impacting both cost and performance.</li></ul>",HIGH,,"<ul class=""list-disc pl-4""><li><strong>Enable Customer-Managed Keys (CMKs):</strong> Configure Amazon SageMaker to use customer-managed keys for encrypting your custom models. This involves setting up and specifying CMKs in the encryption settings for your SageMaker resources.</li><li><strong>Implement Key Policies and Access Controls:</strong> Define and enforce key policies and access controls for your CMKs to ensure that only authorized users and services can access the keys. This helps protect against unauthorized access and misuse.</li><li><strong>Set Up Key Rotation Policies:</strong> Implement automatic key rotation for your CMKs to enhance security and reduce the risk of key compromise. Regular key rotation helps ensure that encryption remains effective over time.</li><li><strong>Monitor Key Usage and Access:</strong> Use AWS CloudTrail and AWS Key Management Service (KMS) logs to track the usage and access of your CMKs. Regularly review these logs to detect any unauthorized access or anomalies.</li><li><strong>Review Compliance Requirements:</strong> Ensure that the use of CMKs aligns with your organization's compliance requirements and security policies. Adjust key management practices as needed to meet regulatory standards.</li><li><strong>Audit and Test Encryption Configurations:</strong> Periodically audit and test your encryption configurations to ensure that CMKs are properly applied and that your custom models are securely encrypted.</li></ul>",7.2,AV:N/AC:L/PR:L/UI:N/S:U/C:H/I:H/A:N,CWE-310: Cryptographic Issues,cloud
Use Guardrails to Protect Agent Sessions,"This vulnerability occurs when agent sessions are not protected using guardrails in Amazon Connect or similar customer contact centers. Guardrails are protective measures and configurations designed to ensure the secure and compliant use of agent sessions. They help manage and restrict actions that agents can perform during their sessions, providing security and compliance controls. <p class=""pt-2"">Without appropriate guardrails, there is a higher risk of unauthorized access, misuse of session data, and potential exposure of sensitive information. Guardrails help mitigate risks such as accidental data leaks, unauthorized actions, or non-compliance with data protection regulations.</p>","<ul class=""list-disc pl-4""><li><strong>Delayed Response to Issues:</strong> Without notifications, administrators might not be immediately aware of critical scaling events, leading to delayed responses to operational issues, such as insufficient capacity or unexpected instance terminations.</li><li><strong>Service Disruptions:</strong> A lack of timely information can result in service disruptions, as scaling events might go unnoticed, leading to either under-provisioned or over-provisioned resources, which can affect application performance and availability.</li><li><strong>Operational Inefficiencies:</strong> Inability to monitor scaling activities can lead to inefficient resource usage, such as maintaining too many or too few instances, impacting both cost and performance.</li></ul>",HIGH,,"<ul class=""list-disc pl-4""><li><strong>Implement Guardrails for Agent Sessions:</strong> Configure and enforce guardrails in your Amazon Connect environment or similar contact center solution. This includes setting up policies that control agent actions, data access, and session management.</li><li><strong>Define and Enforce Access Controls:</strong> Establish and enforce access controls for agent sessions to ensure that only authorized personnel can access and perform specific actions. Implement role-based access controls (RBAC) and least privilege principles.</li><li><strong>Enable Monitoring and Auditing:</strong> Activate logging and monitoring features to track agent actions and session activities. Use these logs for auditing, detecting anomalies, and ensuring compliance with security and regulatory requirements.</li><li><strong>Set Up Alerts for Suspicious Activities:</strong> Configure alerts to notify administrators of any suspicious or unauthorized activities during agent sessions. This helps in early detection and response to potential security incidents.</li><li><strong>Review and Update Guardrail Policies:</strong> Regularly review and update guardrail policies to adapt to changing security requirements and operational needs. Ensure that the policies remain effective in protecting agent sessions.</li></ul>",7.2,AV:N/AC:L/PR:L/UI:N/S:U/C:H/I:H/A:N,CWE-284: Improper Access Control,cloud
Enable AWS CloudFormation Stack Notifications,"This vulnerability arises when AWS CloudFormation stacks do not have notifications enabled. AWS CloudFormation allows you to define and provision infrastructure as code, and stack notifications are a feature that provides alerts on stack events and changes. Enabling notifications helps keep stakeholders informed about the status of stack operations, including creation, updates, and deletions. <p class=""pt-2"">Without notifications, there is a risk of missing critical information about stack changes, which can lead to delayed responses to issues, unawareness of deployment status, and potential disruptions in the infrastructure provisioning process.</p>","<ul class=""list-disc pl-4""><li><strong>Delayed Response to Issues:</strong> Without notifications, administrators might not be immediately aware of critical scaling events, leading to delayed responses to operational issues, such as insufficient capacity or unexpected instance terminations.</li><li><strong>Service Disruptions:</strong> A lack of timely information can result in service disruptions, as scaling events might go unnoticed, leading to either under-provisioned or over-provisioned resources, which can affect application performance and availability.</li><li><strong>Operational Inefficiencies:</strong> Inability to monitor scaling activities can lead to inefficient resource usage, such as maintaining too many or too few instances, impacting both cost and performance.</li></ul>",MEDIUM,,"<ul class=""list-disc pl-4""><li><strong>Enable Stack Notifications:</strong> Configure AWS CloudFormation stacks to send notifications for various stack events such as creation, updates, and deletions. This can be done by setting up Amazon SNS topics and associating them with your CloudFormation stacks.</li><li><strong>Set Up SNS Topics:</strong> Create Amazon SNS topics to receive notifications from CloudFormation. Ensure that these topics are configured with appropriate permissions and are subscribed to by relevant stakeholders and monitoring systems.</li><li><strong>Configure Notification Filters:</strong> Define and configure filters for the types of events you want to be notified about. This helps in receiving relevant alerts and avoiding notification overload.</li><li><strong>Monitor and Review Notifications:</strong> Regularly monitor and review the notifications to stay informed about stack events and status changes. Ensure that notifications are reaching the intended recipients and are actionable.</li><li><strong>Automate Incident Response:</strong> Integrate notifications with incident response systems and workflows to automate the handling of stack-related issues. This helps in reducing response times and improving overall incident management.</li></ul>",6.3,AV:N/AC:L/PR:L/UI:N/S:U/C:H/I:L/A:L,"CWE-264: Permissions, Privileges, and Access Controls",cloud
Enable AWS CloudFormation Stack Termination Protection,"This vulnerability arises when AWS CloudFormation stacks do not have termination protection enabled. Termination protection is a feature that prevents accidental or unauthorized deletion of CloudFormation stacks. By enabling termination protection, you ensure that critical stacks cannot be deleted without explicit user intervention, thus protecting your infrastructure from accidental or malicious deletions. <p class=""pt-2"">Without termination protection, stacks can be deleted even if they are critical to your infrastructure, which can lead to potential data loss, service disruptions, and compliance issues.</p>","<ul class=""list-disc pl-4""><li><strong>Delayed Response to Issues:</strong> Without notifications, administrators might not be immediately aware of critical scaling events, leading to delayed responses to operational issues, such as insufficient capacity or unexpected instance terminations.</li><li><strong>Service Disruptions:</strong> A lack of timely information can result in service disruptions, as scaling events might go unnoticed, leading to either under-provisioned or over-provisioned resources, which can affect application performance and availability.</li><li><strong>Operational Inefficiencies:</strong> Inability to monitor scaling activities can lead to inefficient resource usage, such as maintaining too many or too few instances, impacting both cost and performance.</li></ul>",HIGH,,"<ul class=""list-disc pl-4""><li><strong>Enable Termination Protection:</strong> Configure termination protection for all critical CloudFormation stacks to prevent accidental or unauthorized deletions. This can be done by setting the DeletionPolicy attribute to Retain or by enabling termination protection in the stack settings.</li><li><strong>Review Stack Configurations:</strong> Regularly review stack configurations to ensure that termination protection is enabled for stacks that are critical to your infrastructure and operations.</li><li><strong>Implement Access Controls:</strong> Restrict permissions related to stack deletions to only authorized users or roles. Implement least privilege access controls to minimize the risk of unauthorized stack deletions.</li><li><strong>Monitor Stack Deletions:</strong> Use AWS CloudTrail to monitor and log stack deletion activities. Set up alerts to notify administrators of any deletion attempts or activities involving termination protection.</li><li><strong>Automate Protection Configurations:</strong> Use automation tools and scripts to enforce termination protection across your CloudFormation stacks, ensuring consistent application of this protection measure.</li></ul>",7.1,AV:N/AC:L/PR:L/UI:N/S:U/C:H/I:H/A:L,CWE-682: Incorrect Calculation of Critical Metrics,cloud
Enable CloudFront Distributions Field Level Encryption,"This vulnerability arises when AWS CloudFront distributions do not have field-level encryption enabled. Field-level encryption is a feature that allows you to protect sensitive data within specific fields of HTTP requests and responses as they pass through CloudFront. It ensures that sensitive information, such as personal data or financial details, is encrypted and remains secure as it travels from the client to your origin servers. <p class=""pt-2"">Without field-level encryption, sensitive data transmitted through CloudFront distributions may be exposed in plaintext, increasing the risk of data breaches and unauthorized access. Field-level encryption provides an additional layer of security by encrypting sensitive fields separately from the rest of the data.</p>","<ul class=""list-disc pl-4""><li><strong>Delayed Response to Issues:</strong> Without notifications, administrators might not be immediately aware of critical scaling events, leading to delayed responses to operational issues, such as insufficient capacity or unexpected instance terminations.</li><li><strong>Service Disruptions:</strong> A lack of timely information can result in service disruptions, as scaling events might go unnoticed, leading to either under-provisioned or over-provisioned resources, which can affect application performance and availability.</li><li><strong>Operational Inefficiencies:</strong> Inability to monitor scaling activities can lead to inefficient resource usage, such as maintaining too many or too few instances, impacting both cost and performance.</li></ul>",HIGH,,"<ul class=""list-disc pl-4""><li><strong>Enable Field-Level Encryption:</strong> Configure CloudFront distributions to use field-level encryption for sensitive data. This involves setting up field-level encryption profiles and associating them with your CloudFront distributions.</li><li><strong>Define Encryption Profiles:</strong> Create and configure field-level encryption profiles to specify which fields should be encrypted. Define the encryption keys and settings according to your security requirements.</li><li><strong>Update CloudFront Distribution Settings:</strong> Associate the field-level encryption profiles with your CloudFront distributions. Ensure that the profiles are applied to the relevant HTTP request and response fields.</li><li><strong>Monitor and Review Encryption Settings:</strong> Regularly monitor and review your field-level encryption settings to ensure they remain effective and aligned with your security policies. Update profiles and settings as needed to address changing security requirements.</li><li><strong>Implement Strong Encryption Keys:</strong> Use strong encryption keys and manage them securely. Ensure that encryption keys are rotated periodically and protected against unauthorized access.</li></ul>",7.1,AV:N/AC:L/PR:L/UI:N/S:U/C:H/I:N/A:L,CWE-311: Missing Encryption of Sensitive Data,cloud
Enable HTTPS For CloudFront Distributions,"This vulnerability arises when AWS CloudFront distributions are not configured to use HTTPS for secure data transmission. HTTPS (Hypertext Transfer Protocol Secure) ensures that data exchanged between clients and CloudFront distributions is encrypted, protecting it from interception and tampering during transit. Without HTTPS, data is transmitted in plaintext, increasing the risk of data breaches and unauthorized access. <p class=""pt-2"">Enabling HTTPS for CloudFront distributions is a fundamental security measure to safeguard sensitive information and ensure secure communication between clients and your CloudFront distributions.</p>","<ul class=""list-disc pl-4""><li><strong>Delayed Response to Issues:</strong> Without notifications, administrators might not be immediately aware of critical scaling events, leading to delayed responses to operational issues, such as insufficient capacity or unexpected instance terminations.</li><li><strong>Service Disruptions:</strong> A lack of timely information can result in service disruptions, as scaling events might go unnoticed, leading to either under-provisioned or over-provisioned resources, which can affect application performance and availability.</li><li><strong>Operational Inefficiencies:</strong> Inability to monitor scaling activities can lead to inefficient resource usage, such as maintaining too many or too few instances, impacting both cost and performance.</li></ul>",HIGH,,"<ul class=""list-disc pl-4""><li><strong>Enable HTTPS:</strong> Configure your CloudFront distributions to use HTTPS for secure data transmission. This involves setting up SSL/TLS certificates and configuring your CloudFront distributions to enforce HTTPS connections.</li><li><strong>Obtain and Install SSL/TLS Certificates:</strong> Acquire SSL/TLS certificates from a trusted Certificate Authority (CA) and install them on your CloudFront distributions. Ensure that the certificates are valid and properly configured.</li><li><strong>Redirect HTTP to HTTPS:</strong> Set up redirection rules to automatically redirect HTTP traffic to HTTPS. This ensures that all communication with your CloudFront distributions is encrypted.</li><li><strong>Use Strong TLS Protocols:</strong> Configure CloudFront to use strong TLS protocols and ciphers for secure communication. Avoid outdated and insecure protocols such as TLS 1.0 and 1.1.</li><li><strong>Monitor and Renew Certificates:</strong> Regularly monitor the status of your SSL/TLS certificates and renew them before they expire. Implement automated renewal processes if possible to ensure continuous secure communication.</li></ul>",7.1,AV:N/AC:L/PR:L/UI:N/S:U/C:H/I:N/A:N,CWE-319: Cleartext Transmission of Sensitive Information,cloud
