Vulnerability name ,Description,Impact,Severity,Steps,Fix,Cvss,Cvss_String,Cwe,Type
Enable Mutual TLS Authentication for Kafka Clients,"This vulnerability occurs when Kafka clients are not configured to use mutual TLS authentication. Mutual TLS authentication requires both the client and the server to present valid certificates, providing a more robust security mechanism than traditional one-way authentication. Without mutual TLS authentication, there is a risk of unauthorized access and data breaches.","<ul class=""list-disc pl-4""> <li><strong>Increased risk of unauthorized access:</strong> Without mutual TLS authentication, attackers may be able to impersonate legitimate clients and gain access to sensitive data.</li> <li><strong>Data breaches:</strong> If unauthorized clients gain access to the Kafka cluster, they can potentially exfiltrate sensitive data.</li> <li><strong>Loss of trust:</strong> A data breach can damage an organization's reputation and erode user trust.</li> <li><strong>Compliance risks:</strong> Many compliance frameworks require organizations to implement strong authentication mechanisms. Failure to use mutual TLS authentication can result in non-compliance.</li> </ul>",MEDIUM,,"<ul class=""list-disc pl-4""> <li><strong>Enable mutual TLS authentication:</strong> Configure your Kafka clients and brokers to use mutual TLS authentication.</li> <li><strong>Use strong cryptographic algorithms:</strong> Choose strong cryptographic algorithms and ciphers for SSL/TLS encryption.</li> <li><strong>Verify certificate authenticity:</strong> Ensure that the certificates used for mutual TLS authentication are issued by trusted certificate authorities.</li> <li><strong>Implement client authentication:</strong> Require client authentication to verify the identity of clients connecting to the Kafka cluster.</li> <li><strong>Monitor for suspicious activity:</strong> Keep an eye out for unusual network traffic or unauthorized access attempts, as these could indicate a security breach.</li> </ul>",6.5,AV:N/AC:L/PR:N/UI:N/S:U/C:H/I:N/A:N,CWE-327: Use of a Weak Algorithm or Cryptographic Key,cloud
Publicly Accessible Kafka Clusters,"This vulnerability occurs when Kafka clusters are accessible from the public internet without proper access controls. Publicly accessible Kafka clusters can be easily discovered and exploited by attackers, allowing them to gain unauthorized access to sensitive data.","<ul class=""list-disc pl-4""> <li><strong>Increased risk of unauthorized access:</strong> Publicly accessible Kafka clusters can be discovered and exploited by attackers, allowing them to gain unauthorized access to sensitive data.</li> <li><strong>Data breaches:</strong> If attackers gain access to a Kafka cluster, they can potentially exfiltrate sensitive data.</li> <li><strong>Loss of trust:</strong> A data breach can damage an organization's reputation and erode user trust.</li> <li><strong>Compliance risks:</strong> Many compliance frameworks require organizations to protect sensitive data from unauthorized access. Publicly accessible Kafka clusters can violate these requirements.</li> </ul>",HIGH,,"<ul class=""list-disc pl-4""> <li><strong>Restrict access:</strong> Limit access to Kafka clusters to authorized users and applications using security groups, network ACLs, or VPC peering.</li> <li><strong>Use private VPCs:</strong> Place Kafka clusters in private VPCs to prevent direct access from the public internet.</li> <li><strong>Implement client authentication:</strong> Require client authentication to verify the identity of clients connecting to the Kafka cluster.</li> <li><strong>Monitor for suspicious activity:</strong> Keep an eye out for unusual network traffic or unauthorized access attempts, as these could indicate a security breach.</li> </ul>",8.2,AV:N/AC:L/PR:N/UI:N/S:U/C:H/I:H/A:H,CWE-269: Improper Authorization ,cloud
Upgrade MSK Clusters To Latest Version,"This vulnerability occurs when MSK clusters are not running the latest version, leaving them vulnerable to known security vulnerabilities and performance issues. Outdated MSK clusters may have security flaws that can be exploited by attackers.","<ul class=""list-disc pl-4""> <li><strong>Increased risk of unauthorized access:</strong> Outdated MSK clusters may contain vulnerabilities that can be exploited by attackers to gain unauthorized access.</li> <li><strong>Data breaches:</strong> If vulnerabilities are exploited, attackers could potentially exfiltrate sensitive data.</li> <li><strong>Performance issues:</strong> Older versions of MSK may have performance limitations or inefficiencies that can impact the availability and reliability of your Kafka applications.</li> <li><strong>Compliance risks:</strong> Some compliance frameworks require organizations to use the latest versions of software to maintain a secure environment.</li> </ul>",MEDIUM,,"<ul class=""list-disc pl-4""> <li><strong>Stay up-to-date with MSK versions:</strong> Regularly review the latest MSK versions and upgrade your clusters to the latest supported version.</li> <li><strong>Test upgrades thoroughly:</strong> Test upgrades in a non-production environment before applying them to production clusters to ensure compatibility and avoid disruptions.</li> <li><strong>Monitor for security vulnerabilities:</strong> Keep an eye out for security advisories and patches related to MSK to address known vulnerabilities promptly.</li> <li><strong>Implement a patching process:</strong> Establish a process for applying security patches and updates to MSK clusters in a timely manner.</li> <li><strong>Consider using automated patching tools:</strong> Utilize automated patching tools to streamline the upgrade process and reduce the risk of human error.</li> </ul>",6,AV:N/AC:L/PR:L/UI:N/S:U/C:H/I:H/A:H,CWE-1328: Security Version Number Mutable to Older Versions,cloud
Unrestricted Access To Apache Kafka Brokers,"This vulnerability occurs when Apache Kafka brokers are accessible from the public internet without proper access controls. Publicly accessible Kafka brokers can be easily discovered and exploited by attackers, allowing them to gain unauthorized access to sensitive data.","<ul class=""list-disc pl-4""> <li><strong>Increased risk of unauthorized access:</strong> Publicly accessible Kafka brokers can be discovered and exploited by attackers, allowing them to gain unauthorized access to sensitive data.</li> <li><strong>Data breaches:</strong> If attackers gain access to a Kafka cluster, they can potentially exfiltrate sensitive data.</li> <li><strong>Loss of trust:</strong> A data breach can damage an organization's reputation and erode user trust.</li> <li><strong>Compliance risks:</strong> Many compliance frameworks require organizations to protect sensitive data from unauthorized access. Publicly accessible Kafka brokers can violate these requirements.</li> </ul>",HIGH,,"<ul class=""list-disc pl-4""> <li><strong>Restrict access:</strong> Limit access to Kafka brokers to authorized users and applications using security groups, network ACLs, or VPC peering.</li> <li><strong>Use private VPCs:</strong> Place Kafka brokers in private VPCs to prevent direct access from the public internet.</li> <li><strong>Implement client authentication:</strong> Require client authentication to verify the identity of clients connecting to the Kafka cluster.</li> <li><strong>Monitor for suspicious activity:</strong> Keep an eye out for unusual network traffic or unauthorized access attempts, as these could indicate a security breach.</li> </ul>",8,AV:N/AC:L/PR:N/UI:N/S:U/C:H/I:H/A:H,CWE-287: Improper Authentication,cloud
Enable Kinesis Data Firehose Delivery Stream Encryption,"This vulnerability occurs when Kinesis Data Firehose delivery streams are not encrypted, leaving sensitive data exposed to unauthorized access. Encryption helps protect data from unauthorized access, even if the underlying storage or network is compromised.","<ul class=""list-disc pl-4""> <li><strong>Data breaches:</strong> If attackers gain unauthorized access to a delivery stream, they can potentially exfiltrate sensitive data.</li> <li><strong>Loss of trust:</strong> A data breach can damage an organization's reputation and erode user trust.</li> <li><strong>Compliance risks:</strong> Many compliance frameworks require organizations to encrypt sensitive data. Failure to do so can result in fines or penalties.</li> </ul>",HIGH,,"<ul class=""list-disc pl-4""> <li><strong>Enable encryption:</strong> Configure your Kinesis Data Firehose delivery streams to use encryption.</li> <li><strong>Use a dedicated CMK:</strong> Create a dedicated Customer Master Key (CMK) for your delivery streams to ensure that it is not used for other purposes, reducing the risk of compromise.</li> <li><strong>Implement a key rotation policy:</strong> Regularly rotate the CMK used for encryption to minimize the risk of compromise.</li> <li><strong>Monitor for suspicious activity:</strong> Keep an eye out for unusual network traffic or unauthorized access attempts, as these could indicate a security breach.</li> </ul>",8.2,AV:N/AC:L/PR:N/UI:N/S:U/C:H/I:H/A:H,CWE-327: Use of a Weak Algorithm or Cryptographic Key,cloud
Encrypte Kinesis Stream Using Customer Master Keys (CMKs),"This vulnerability occurs when Kinesis data streams are not encrypted using Customer Master Keys (CMKs). Encryption helps protect sensitive data from unauthorized access, even if the underlying storage or network is compromised.","<ul class=""list-disc pl-4""> <li><strong>Data breaches:</strong> If attackers gain unauthorized access to a Kinesis stream, they can potentially exfiltrate sensitive data.</li> <li><strong>Loss of trust:</strong> A data breach can damage an organization's reputation and erode user trust.</li> <li><strong>Compliance risks:</strong> Many compliance frameworks require organizations to encrypt sensitive data. Failure to do so can result in fines or penalties.</li> </ul>",HIGH,,"<ul class=""list-disc pl-4""> <li><strong>Enable encryption:</strong> Configure your Kinesis data streams to use encryption.</li> <li><strong>Use a dedicated CMK:</strong> Create a dedicated Customer Master Key (CMK) for your Kinesis streams to ensure that it is not used for other purposes, reducing the risk of compromise.</li> <li><strong>Implement a key rotation policy:</strong> Regularly rotate the CMK used for encryption to minimize the risk of compromise.</li> <li><strong>Monitor for suspicious activity:</strong> Keep an eye out for unusual network traffic or unauthorized access attempts, as these could indicate a security breach.</li> </ul>",8.2,AV:N/AC:L/PR:N/UI:N/S:U/C:H/I:H/A:H,CWE-327: Use of a Weak Algorithm or Cryptographic Key,cloud
KMS Cross Account Access Allowed,"This vulnerability occurs when a KMS key is configured to allow cross-account access. Cross-account access enables other AWS accounts to use the KMS key for encryption and decryption, which can increase the risk of unauthorized access and data breaches.","<ul class=""list-disc pl-4""> <li><strong>Increased risk of unauthorized access:</strong> If an attacker gains access to another AWS account with permission to use the KMS key, they can use it to encrypt and decrypt data.</li> <li><strong>Data breaches:</strong> Compromised KMS keys can lead to data breaches if sensitive data is encrypted using them.</li> <li><strong>Loss of control over the key:</strong> Once cross-account access is granted, it can be difficult to revoke or restrict access in the future.</li> <li><strong>Compliance risks:</strong> Many compliance frameworks require organizations to control access to sensitive data. Allowing cross-account access can violate these requirements.</li> </ul>",HIGH,,"<ul class=""list-disc pl-4""> <li><strong>Restrict cross-account access:</strong> Configure KMS keys to allow access only from specific AWS accounts or IAM roles that have been verified and trusted.</li> <li><strong>Use IAM roles:</strong> Grant access to KMS keys using IAM roles rather than individual users to improve management and control.</li> <li><strong>Implement least privilege principle:</strong> Grant IAM roles only the minimum permissions necessary to perform their tasks.</li> <li><strong>Monitor for suspicious activity:</strong> Keep an eye out for unusual network traffic or unauthorized access attempts, as these could indicate a security breach.</li> </ul>",7.5,AV:N/AC:L/PR:N/UI:N/S:U/C:H/I:N/A:N,CWE-269: Improper Authorization,cloud
KMS Customer Master Key Pending Deletion,This vulnerability occurs when a KMS Customer Master Key (CMK) is in a pending deletion state. A pending deletion CMK is scheduled for deletion but can still be used for encryption and decryption. This can increase the risk of unauthorized access and data breaches if the CMK is not deleted as planned.,"<ul class=""list-disc pl-4""> <li><strong>Increased risk of unauthorized access:</strong> If a pending deletion CMK is not deleted as planned, it can be used by unauthorized individuals to encrypt and decrypt data.</li> <li><strong>Data breaches:</strong> Compromised KMS keys can lead to data breaches if sensitive data is encrypted using them.</li> <li><strong>Loss of control over the key:</strong> Once a CMK is scheduled for deletion, it can be difficult to recover or restore it if needed.</li> <li><strong>Compliance risks:</strong> Many compliance frameworks require organizations to manage cryptographic keys securely. Failure to delete pending CMK can violate these requirements.</li> </ul>",MEDIUM,,"<ul class=""list-disc pl-4""> <li><strong>Review pending deletion CMKs regularly:</strong> Monitor the status of pending deletion CMKs and ensure that they are deleted according to the planned schedule.</li> <li><strong>Delete CMKs promptly:</strong> If a CMK is no longer needed, delete it as soon as possible to reduce the risk of unauthorized access.</li> <li><strong>Implement a key management process:</strong> Establish a process for managing cryptographic keys, including creation, rotation, and deletion.</li> <li><strong>Monitor for suspicious activity:</strong> Keep an eye out for unusual network traffic or unauthorized access attempts, as these could indicate a security breach.</li> </ul>",6.4,AV:N/AC:L/PR:N/UI:N/S:U/C:L/I:L/A:L,CWE-269: Improper Authorization,cloud
KMS Key Exposed,"This vulnerability occurs when a KMS Customer Master Key (CMK) is exposed to unauthorized access, either through accidental disclosure or due to a security breach. Exposed KMS keys can be used to encrypt and decrypt data, compromising the confidentiality and integrity of sensitive information.","<ul class=""list-disc pl-4""> <li><strong>Increased risk of unauthorized access:</strong> Exposed KMS keys can be used by unauthorized individuals to encrypt and decrypt data.</li> <li><strong>Data breaches:</strong> Compromised KMS keys can lead to data breaches if sensitive data is encrypted using them.</li> <li><strong>Loss of control over the key:</strong> Once a KMS key is exposed, it can be difficult to recover or restore it.</li> <li><strong>Compliance risks:</strong> Many compliance frameworks require organizations to protect cryptographic keys securely. Exposing KMS keys can violate these requirements.</li> </ul>",HIGH,,"<ul class=""list-disc pl-4""> <li><strong>Protect KMS key material:</strong> Store KMS key material securely and avoid exposing it to unauthorized individuals.</li> <li><strong>Implement strong access controls:</strong> Restrict access to KMS keys to authorized users and applications.</li> <li><strong>Monitor for suspicious activity:</strong> Keep an eye out for unusual network traffic or unauthorized access attempts, as these could indicate a security breach.</li> <li><strong>Regularly rotate KMS keys:</strong> Rotate KMS keys periodically to reduce the risk of compromise.</li> <li><strong>Use a key management system:</strong> Employ a robust key management system to manage and protect KMS keys effectively.</li> </ul>",8.2,AV:N/AC:L/PR:N/UI:N/S:U/C:H/I:H/A:H,CWE-200: Information Exposure,cloud
KMS Key Rotation Not Enabled,This vulnerability occurs when KMS Customer Master Keys (CMKs) are not configured for automatic rotation. Regular key rotation helps mitigate the risk of compromise and ensures that cryptographic keys remain strong over time.,"<ul class=""list-disc pl-4""> <li><strong>Increased risk of unauthorized access:</strong> If a KMS key is compromised, it can be used to encrypt and decrypt data, potentially leading to unauthorized access.</li> <li><strong>Data breaches:</strong> Compromised KMS keys can lead to data breaches if sensitive data is encrypted using them.</li> <li><strong>Loss of control over the key:</strong> Once a KMS key is compromised, it can be difficult to recover or restore it.</li> <li><strong>Compliance risks:</strong> Many compliance frameworks require organizations to rotate cryptographic keys regularly. Failure to do so can violate these requirements.</li> </ul>",MEDIUM,,"<ul class=""list-disc pl-4""> <li><strong>Enable key rotation:</strong> Configure your KMS CMKs for automatic rotation at regular intervals.</li> <li><strong>Set appropriate rotation schedules:</strong> Determine the appropriate rotation frequency based on your organization's specific security requirements and compliance standards.</li> <li><strong>Monitor key rotation status:</strong> Regularly review the status of key rotation to ensure that it is occurring as planned.</li> <li><strong>Implement a key management process:</strong> Establish a process for managing cryptographic keys, including creation, rotation, and deletion.</li> <li><strong>Monitor for suspicious activity:</strong> Keep an eye out for unusual network traffic or unauthorized access attempts, as these could indicate a security breach.</li> </ul>",5.3,AV:N/AC:L/PR:L/UI:N/S:U/C:L/I:L/A:L,CWE-327: Use of a Weak Algorithm or Cryptographic Key,cloud
Unused Customer Master Key,This vulnerability occurs when a KMS Customer Master Key (CMK) is no longer in use but is still active. Unused CMKs can increase the risk of unauthorized access and data breaches if they are not properly managed.,"<ul class=""list-disc pl-4""> <li><strong>Increased risk of unauthorized access:</strong> If an unused CMK is not deleted, it can be accidentally or maliciously used to encrypt and decrypt data.</li> <li><strong>Data breaches:</strong> Compromised KMS keys can lead to data breaches if sensitive data is encrypted using them.</li> <li><strong>Compliance risks:</strong> Many compliance frameworks require organizations to manage cryptographic keys securely. Unused CMKs can violate these requirements.</li> </ul>",MEDIUM,,"<ul class=""list-disc pl-4""> <li><strong>Identify unused CMKs:</strong> Regularly review your KMS environment to identify CMKs that are no longer in use.</li> <li><strong>Delete unused CMKs:</strong> Delete CMKs that are no longer needed to reduce the risk of unauthorized access.</li> <li><strong>Implement a key management process:</strong> Establish a process for managing cryptographic keys, including creation, rotation, and deletion.</li> <li><strong>Monitor for suspicious activity:</strong> Keep an eye out for unusual network traffic or unauthorized access attempts, as these could indicate a security breach.</li> </ul>",4.7,AV:N/AC:L/PR:N/UI:N/S:U/C:L/I:N/A:N,CWE-732: Incorrect Permission Assignment for Critical Resource,cloud
Lambda Functions Resource-Based Policy Set As Public,"This vulnerability occurs when Lambda functions have resource-based policies that grant public access. Public access policies allow anyone with internet access to invoke the Lambda function, potentially exposing sensitive data or enabling unauthorized actions.","<ul class=""list-disc pl-4""> <li><strong>Increased risk of unauthorized access:</strong> Publicly accessible Lambda functions can be invoked by anyone with internet access, allowing unauthorized individuals to access sensitive data or perform malicious actions.</li> <li><strong>Data breaches:</strong> If a Lambda function processes sensitive data and is publicly accessible, the data could be exposed to unauthorized individuals.</li> <li><strong>Denial of service (DoS) attacks:</strong> Publicly accessible Lambda functions can be targeted with DoS attacks, which can disrupt the availability of your applications.</li> <li><strong>Compliance risks:</strong> Many compliance frameworks require organizations to protect sensitive data from unauthorized access. Publicly accessible Lambda functions can violate these requirements.</li> </ul>",HIGH,,"<ul class=""list-disc pl-4""> <li><strong>Restrict access:</strong> Configure resource-based policies for Lambda functions to limit access to authorized users or applications.</li> <li><strong>Use VPC endpoints:</strong> Place Lambda functions in a private VPC and use VPC endpoints to restrict access to the public internet.</li> <li><strong>Implement IAM roles:</strong> Grant access to Lambda functions using IAM roles rather than individual users to improve management and control.</li> <li><strong>Monitor for suspicious activity:</strong> Keep an eye out for unusual network traffic or unauthorized access attempts, as these could indicate a security breach.</li> </ul>",8.5,AV:N/AC:L/PR:N/UI:N/S:U/C:H/I:H/A:H,CWE-269: Improper Authorization,cloud
Enable Lambda Functions CloudTrail Logging,"This vulnerability occurs when CloudTrail logging is not enabled for Lambda functions. CloudTrail logs API calls made to AWS services, providing valuable insights into user activity and potential security threats. Disabling CloudTrail logging for Lambda functions can hinder the ability to detect and respond to security incidents.","<ul class=""list-disc pl-4""> <li><strong>Reduced visibility into Lambda function activity:</strong> Without CloudTrail logging, it can be difficult to track and monitor Lambda function invocations, making it harder to detect unauthorized access or malicious activity.</li> <li><strong>Delayed response to security incidents:</strong> Lack of logging can delay the detection and response to security incidents, increasing the risk of data breaches or other adverse consequences.</li> <li><strong>Compliance risks:</strong> Many compliance frameworks require organizations to log and monitor AWS activities. Disabling CloudTrail logging can violate these requirements.</li> </ul>",HIGH,,"<ul class=""list-disc pl-4""> <li><strong>Enable CloudTrail logging:</strong> Enable CloudTrail logging for your Lambda functions to capture API calls and provide visibility into user activity.</li> <li><strong>Configure CloudTrail settings:</strong> Customize CloudTrail settings to log the desired events and data types.</li> <li><strong>Review and analyze logs:</strong> Regularly review CloudTrail logs to identify any suspicious activity or security incidents.</li> <li><strong>Implement alerting:</strong> Set up alerts to notify you of significant events or security threats detected in CloudTrail logs.</li> <li><strong>Consider using CloudTrail Advanced Event Formats:</strong> Enable CloudTrail Advanced Event Formats to capture more detailed information about API calls.</li> </ul>",7.5,AV:N/AC:L/PR:N/UI:N/S:U/C:H/I:N/A:N,CWE-200: Information Exposure,cloud
Lambda Functions Without URL Configuration,"This vulnerability occurs when Lambda functions are deployed without a URL configuration. Without a URL configuration, Lambda functions cannot be invoked directly over the internet, limiting their accessibility. However, it's important to note that this vulnerability can be exploited in conjunction with other misconfigurations or vulnerabilities to allow unauthorized access.","<ul class=""list-disc pl-4""> <li><strong>Limited functionality:</strong> Lambda functions without a URL configuration cannot be invoked directly over the internet, limiting their usability.</li> <li><strong>Increased complexity:</strong> Invoking Lambda functions without a URL configuration requires additional steps, such as using the AWS SDK or the AWS CLI.</li> <li><strong>Potential security risks:</strong> While not directly exploitable, Lambda functions without URL configurations can be used in conjunction with other misconfigurations or vulnerabilities to allow unauthorized access.</li> </ul>",MEDIUM,,"<ul class=""list-disc pl-4""> <li><strong>Configure a URL configuration:</strong> If your Lambda function needs to be publicly accessible, configure a URL configuration to allow direct invocation over the internet.</li> <li><strong>Use VPC endpoints:</strong> If you need to restrict access to a Lambda function, consider using VPC endpoints to allow access only from within your VPC.</li> <li><strong>Implement strong access controls:</strong> Use IAM roles and policies to control who can invoke your Lambda functions.</li> <li><strong>Monitor for suspicious activity:</strong> Keep an eye out for unusual network traffic or unauthorized access attempts, as these could indicate a security breach.</li> </ul>",4.3,AV:N/AC:L/PR:N/UI:N/S:U/C:L/I:N/A:N,CWE-16: Configuration,cloud
