Vulnerability name ,Description,Impact,Severity,Steps,Fix,Cvss,Cvss_String,Cwe,Type
Endpoints Discovered,"Endpoints discovered refer to the process where attackers identify various API or web application endpoints that are publicly accessible or exposed. These endpoints can reveal valuable information about the application's structure, functionality, and available services. Attackers can leverage this information to gain insights into how the application works, what data it handles, and potential vulnerabilities in the exposed endpoints. Once endpoints are discovered, attackers can use this information to probe for vulnerabilities, exploit security weaknesses, or manipulate the application's data and behavior.","The impact of discovering endpoints in an application can vary depending on the level of exposure and the sensitivity of the endpoints: <ul class=""list-disc pt-2 pl-4""> <li><strong>Unauthorized Access:</strong> Attackers who discover endpoints may attempt to access them directly, potentially bypassing authentication or authorization mechanisms. This can lead to unauthorized access to sensitive data, functionalities, or resources.</li> <li><strong>Reconnaissance:</strong> Knowledge of endpoints can provide attackers with valuable information about the structure and functionality of an application. This can aid in planning and executing targeted attacks.</li> <li><strong>Exploitation of Vulnerabilities:</strong> If the endpoints have vulnerabilities, attackers may exploit them to gain access to the application or its data. This can lead to data breaches, account takeovers, or other forms of exploitation.</li> <li><strong>Manipulation of Data:</strong> Attackers may use discovered endpoints to manipulate data within the application. This can include altering records, injecting malicious data, or disrupting normal operations.</li> </ul>",INFO,"Discovering endpoints can occur through techniques such as: <ul class=""list-disc pt-2 pl-4""> <li><strong>Web Crawling:</strong> Scanning the application's publicly accessible URLs and directories to discover available endpoints.</li> <li><strong>Brute Forcing:</strong> Systematically trying different URL patterns or parameter combinations to uncover hidden endpoints.</li> <li><strong>Reverse Engineering:</strong> Analyzing client-side code, such as JavaScript files, or network traffic to identify and map application endpoints.</li> </ul>","To address the risks associated with the discovery of endpoints, organizations should implement the following suggested fixes: <ul class=""list-disc pt-2 pl-4""> <li><strong>Proper Authentication and Authorization:</strong> Secure endpoints by requiring authentication and authorization checks for all requests. Use role-based access control (RBAC) to limit access to endpoints based on user roles and permissions.</li> <li><strong>Rate Limiting and Throttling:</strong> Implement rate limiting and request throttling to prevent attackers from exploiting endpoints through brute-force attacks or denial-of-service (DoS) attacks.</li> <li><strong>Input Validation and Output Encoding:</strong> Validate all input data to ensure it meets expected criteria and avoid injection attacks. Encode output data to protect against cross-site scripting (XSS) and other injection attacks.</li> <li><strong>Secure API Design:</strong> Follow best practices for secure API design, such as using HTTPS for all communication, avoiding unnecessary data exposure, and using secure tokens for authentication.</li> <li><strong>Minimize Endpoint Exposure:</strong> Limit the number of publicly accessible endpoints to only those necessary for the application's functionality. Hide internal or administrative endpoints behind secure firewalls or VPNs.</li> </ul>",0,AV:N/AC:H/PR:N/UI:N/S:U/C:N/I:N/A:N,CWE-200: Exposure of Sensitive Information to an Unauthorized Actor,list
Directory Listing Enabled,"Web servers can be configured to automatically list the contents of directories that do not have an index page present. This can aid an attacker by enabling them to quickly identify the resources at a given path, and proceed directly to analyzing and attacking those resources. It particularly increases the exposure of sensitive files within the directory that are not intended to be accessible to users, such as temporary files and crash dumps.<p class=""pt-3"">Directory listings themselves do not necessarily constitute a security vulnerability. Any sensitive resources within the web root should in any case be properly access-controlled, and should not be accessible by an unauthorized party who happens to know or guess the URL. Even when directory listings are disabled, an attacker may guess the location of sensitive files using automated tools.</p>","<ul class=""list-disc pl-4""> <li><strong>Sensitive Files:</strong> Directory listings can expose files that contain sensitive information, such as configuration files, backup files, or private documents. These files might include credentials, internal communications, or other confidential data.</li> <li><strong>Discovery of Hidden Resources:</strong> Attackers can discover hidden resources that are not linked or indexed, such as admin panels, test files, or deprecated scripts.</li> <li><strong>Identification of Vulnerable Files:</strong> Attackers can identify and exploit files with known vulnerabilities (e.g., outdated scripts with security flaws).</li> <li><strong>Website Structure Insight:</strong> Attackers can gain a comprehensive understanding of the website's directory structure, making it easier to identify important files and directories.</li> </ul>",MEDIUM,"Discovering endpoints can occur through techniques such as: <ul class=""list-disc pt-2 pl-4""> <li><strong>Web Crawling:</strong> Scanning the application's publicly accessible URLs and directories to discover available endpoints.</li> <li><strong>Brute Forcing:</strong> Systematically trying different URL patterns or parameter combinations to uncover hidden endpoints.</li> <li><strong>Reverse Engineering:</strong> Analyzing client-side code, such as JavaScript files, or network traffic to identify and map application endpoints.</li> </ul>","There is not usually any good reason to provide directory listings, and disabling them may place additional hurdles in the path of an attacker. This can normally be achieved in two ways: <ul class=""list-disc pt-2 pl-4 pb-3""> <li>Configure your web server to prevent directory listings for all paths beneath the web root;</li> <li>Place into each directory a default file (such as index.htm) that the web server will display instead of returning a directory listing.</li><li> Disable directory listing in the web server configuration (e.g., using .htaccess for Apache or nginx.conf for NGINX).</li> <li> Implement proper access controls to restrict unauthorized access to directories. </li> </ul> For <strong>Apache</strong> web server, disabling directory listing can be achieved by adding the following line to the <i>.htaccess</i> file or the server configuration: <div class=""my-2 mx-5 p-2 bg-gray-200 rounded-lg text-xs italic""> <p class=""py-1""> Options -Indexes</p> </div> For <strong>NGINX</strong>, the following directive can be added to the server block: <div class=""my-2 mx-5 p-2 bg-gray-200 rounded-lg text-xs italic""> <p class=""py-1""> autoindex off;</p> </div>",5.3,AV:N/AC:L/PR:N/UI:N/S:U/C:L/I:N/A:N,CWE-548: Exposure of Information Through Directory Listing,list
Insecure Cross-Origin Resource Sharing Configuration,"Cross-origin resource sharing (CORS) is a browser mechanism which enables controlled access to resources located outside of a given domain. It extends and adds flexibility to the same-origin policy (SOP). However, it also provides potential for cross-domain attacks, if a website's CORS policy is poorly configured and implemented. CORS is not a protection against cross-origin attacks such as cross-site request forgery (CSRF).<p class=""pt-2"">CORS Misconfiguration occurs when a web application's Cross-Origin Resource Sharing (CORS) policy is improperly configured, allowing unauthorized domains to access restricted resources. This vulnerability can lead to significant security issues, such as data theft, unauthorized actions, and exposure of sensitive information.</p>","An attacker can exploit a CORS Misconfiguration to: <ul class=""list-disc pl-8""> <li> Access sensitive data from the victim's web application.</li> <li>Perform unauthorized actions on behalf of a legitimate user.</li> <li>Bypass same-origin policy protections, leading to potential data breaches.</li> <li>Exploit other vulnerabilities in conjunction with CORS Misconfiguration to escalate attacks.</li> </ul> <p class=""font-semibold pt-2"">Common Causes:</p> <ul class=""list-disc pl-8""> <li> Allowing all origins (<b>*</b>) in the CORS policy.</li> <li>Permitting unsafe HTTP methods (e.g., PUT, DELETE) from untrusted origins.</li> <li>Incorrectly configuring the Access-Control-Allow-Origin header.</li> <li>Failing to properly validate and restrict the Origin header.</li> </ul>",MEDIUM,"Craft a request with the `Origin` header set to a random URL; in this example, we used <i class=""text-red-500 border-b border-b-red-500"">https://evil.com</i>. Examine the response header to check the value of <i>Access-Control-Allow-Origin</i>. It will either be <b>*</b> or the URL we specified in the <i>Origin</i> header.","By ensuring a properly configured CORS policy, web applications can effectively prevent unauthorized cross-origin access and protect sensitive data from malicious actors. <ul class=""list-disc pl-4""> <li> Define a strict CORS policy, specifying only trusted domains.</li> <li>Avoid using wildcard (<b>*</b>) in the <i>Access-Control-Allow-Origin</i> header.</li> <li>Restrict HTTP methods to only those necessary and safe.</li> <li>Implement proper validation and sanitation of the <i>Origin</i> header.</li> </ul>",6.1,AV:N/AC:L/PR:N/UI:R/S:C/C:L/I:L/A:N,CWE-942: Permissive Cross-domain Whitelist,list
Missing Security Headers,"Missing security headers refers to the absence of HTTP headers that enhance the security of web applications and protect against common attacks. These headers provide instructions to web browsers on how to handle certain aspects of web pages, such as content type, origin policy, caching behavior, and scripts execution. Common security headers that may be missing include: <ul class=""list-disc pt-2 pl-4""> <li><strong>Content Security Policy (CSP):</strong> Helps prevent cross-site scripting (XSS) and data injection attacks by specifying which sources and types of content are allowed to be loaded and executed on the page.</li> <li><strong>HTTP Strict Transport Security (HSTS):</strong> Forces browsers to connect to the server using a secure HTTPS connection and protects against downgrade attacks.</li> <li><strong>X-Content-Type-Options:</strong> Protects against MIME type sniffing, which can lead to the execution of malicious content.</li> <li><strong>X-Frame-Options:</strong> Prevents clickjacking attacks by controlling whether the page can be embedded within an iframe.</li> <li><strong>X-XSS-Protection:</strong> Provides basic XSS filtering capabilities and instructs the browser to block or sanitize the page if an XSS attack is detected.</li> <li><strong>Referrer-Policy:</strong> Controls the information sent in the Referer header, protecting user privacy by limiting data leakage.</li> </ul>","The impact of having missing or misconfigured security headers can be detrimental to the security and privacy of a web application and its users: <ul class=""list-disc pt-2 pl-4""> <li><strong>Cross-Site Scripting (XSS) Attacks:</strong> Without a properly configured Content Security Policy (CSP) header, the application is more vulnerable to XSS attacks. Attackers can inject malicious scripts into web pages, potentially leading to data theft, session hijacking, or unauthorized actions on behalf of the user.</li> <li><strong>Clickjacking Attacks:</strong> The absence of the X-Frame-Options header allows attackers to embed the web application within an iframe and trick users into clicking on hidden or deceptive content. This can result in unauthorized actions being performed, such as changing user settings or executing transactions.</li> <li><strong>Man-in-the-Middle Attacks:</strong> Missing the HTTP Strict Transport Security (HSTS) header can expose the application to man-in-the-middle attacks, where attackers intercept and manipulate data transmitted between the user and the server. This can lead to data breaches, privacy violations, and tampering with sensitive information.</li> <li><strong>MIME Type Sniffing:</strong> Without the X-Content-Type-Options header set to ""nosniff,"" the browser may attempt to determine the content type of a response based on its content rather than the declared content type. This can lead to unintended content execution or the display of malicious content, posing security risks.</li> <li><strong>Information Leakage:</strong> The absence of the Referrer-Policy header can result in unintentional exposure of user data, such as the URL of the referring page. This can lead to privacy concerns and potential data leakage.</li> <li><strong>Data Integrity Risks:</strong> Without the X-XSS-Protection header, the application lacks basic protection against XSS attacks. This can impact data integrity and user trust in the application's ability to secure their information.</li> </ul>",MEDIUM,"During the scan, the following security headers were missing from the response headers:","<p><strong>Content Security Policy (CSP)</strong><p> <div class=""px-5 mb-3""> Configuring Content Security Policy involves adding the Content-Security-Policy HTTP header to a web page and giving it values to control w2at resources the user agent is allowed to load for that page. For example, a page that uploads and displays images could allow images from anywhere, but restrict a form action to a specific endpoint. A properly designed Content Security Policy helps protect a page against a cross-site scripting attack. <div class=""my-2 mx-5 p-2 bg-gray-200 rounded-lg text-xs w-fit italic""> <p class=""py-1"">Content-Security-Policy: default-src 'self'</p> <p class=""py-1"">Content-Security-Policy: default-src 'self' example.com *.example.com</p> <p class=""py-1"">Content-Security-Policy: default-src 'self'; img-src *; media-src example.net; script-src scripts.example.com</p> </div> </div> <p><strong>Strict-Transport-Security (HSTS)</strong><p> <div class=""px-5 mb-3""> If a website accepts a connection through HTTP and redirects to HTTPS, visitors may initially communicate with the non-encrypted version of the site before being redirected, if, for example, the visitor types http://www.foo.com/ or even just foo.com. This creates an opportunity for a man-in-the-middle attack. The redirect could be exploited to direct visitors to a malicious site instead of the secure version of the original site. <p>The HTTP Strict Transport Security header informs the browser that it should never load a site using HTTP and should automatically convert all attempts to access the site using HTTP to HTTPS requests instead.<p> <div class=""my-2 mx-5 p-2 bg-gray-200 rounded-lg text-xs w-fit italic""> <p class=""py-1"">Strict-Transport-Security: max-age=&lt;expire-time&gt;</p> <p class=""py-1"">Strict-Transport-Security: max-age=&lt;expire-time&gt;; includeSubDomains</p> <p class=""py-1"">Strict-Transport-Security: max-age=&lt;expire-time&gt;; includeSubDomains; preload</p> </div> </div> <p><strong>X-Content-Type-Options</strong><p> <div class=""px-5 mb-3""> The X-Content-Type-Options response HTTP header is a marker used by the server to indicate that the MIME types advertised in the Content-Type headers should be followed and not be changed. The header allows you to avoid MIME type sniffing by saying that the MIME types are deliberately configured. <div class=""my-2 mx-5 p-2 bg-gray-200 rounded-lg text-xs w-fit italic""> <p class=""py-1"">X-Content-Type-Options: nosniff</p> </div> </div> <p><strong>X-Frame-Options</strong><p> <div class=""px-5 mb-3""> The X-Frame-Options HTTP response header can be used to indicate whether a browser should be allowed to render a page in a &lt;frame&gt;, &lt;iframe&gt;, &lt;embed&gt; or &lt;object&gt;. Sites can use this to avoid click-jacking attacks, by ensuring that their content is not embedded into other sites. <div class=""my-2 mx-5 p-2 bg-gray-200 rounded-lg text-xs w-fit italic""> <p class=""py-1"">X-Frame-Options: DENY</p> <p class=""py-1"">X-Frame-Options: SAMEORIGIN</p> </div> </div> <p><strong>Referrer-Policy</strong><p> <div class=""px-5 mb-3""> The Referrer-Policy HTTP header controls how much referrer information (sent with the Referer header) should be included with requests. Aside from the HTTP header, you can set this policy in HTML. <div class=""my-2 mx-5 p-2 bg-gray-200 rounded-lg text-xs w-fit italic""> <p class=""py-1"">Referrer-Policy: no-referrer</p> <p class=""py-1"">Referrer-Policy: no-referrer-when-downgrade</p> <p class=""py-1"">Referrer-Policy: origin</p> <p class=""py-1"">Referrer-Policy: origin-when-cross-origin</p> <p class=""py-1"">Referrer-Policy: same-origin</p> <p class=""py-1"">Referrer-Policy: strict-origin</p> <p class=""py-1"">Referrer-Policy: strict-origin-when-cross-origin</p> <p class=""py-1"">Referrer-Policy: unsafe-url</p> </div> </div> <p><strong>Permissions Policy</strong><p> <div class=""px-5 mb-3""> Permissions Policy provides mechanisms for web developers to explicitly declare what functionality can and cannot be used on a website. You define a set of ""policies"" that restrict what APIs the site's code can access or modify the browser's default behavior for certain features. This allows you to enforce best practices, even as the codebase evolves — as well as more safely compose third-party content. <p>Permissions Policy is similar to Content Security Policy but controls features instead of security behavior.</p> <div class=""my-2 mx-5 p-2 bg-gray-200 rounded-lg text-xs w-fit italic""> <p class=""py-1"">Permissions-Policy: &lt;directive&gt;=&lt;allowlist&gt;</p> <p class=""py-1"">Permissions-Policy: geolocation=()</p> <p class=""py-1"">Permissions-Policy: geolocation=(self ""https://a.example.com"" ""https://b.example.com"")</p> <p class=""py-1"">Permissions-Policy: picture-in-picture=(), geolocation=(self https://example.com), camera=*;</p> </div> </div> <p><strong>Cross-Origin-Embedder-Policy (COEP)</strong><p> <div class=""px-5 mb-3""> The HTTP Cross-Origin-Embedder-Policy (COEP) response header configures embedding cross-origin resources into the document. <div class=""my-2 mx-5 p-2 bg-gray-200 rounded-lg text-xs w-fit italic""> <p class=""py-1"">Cross-Origin-Embedder-Policy: unsafe-none | require-corp | credentialless</p> </div> </div> <p><strong>Cross-Origin Resource Policy (CORP)</strong><p> <div class=""px-5 mb-3""> Cross-Origin Resource Policy is a policy set by the Cross-Origin-Resource-Policy HTTP header that lets websites and applications opt in to protection against certain requests from other origins (such as those issued with elements like &lt;script&gt; and &lt;img&gt;), to mitigate speculative side-channel attacks, like Spectre, as well as Cross-Site Script Inclusion attacks. <div class=""my-2 mx-5 p-2 bg-gray-200 rounded-lg text-xs w-fit italic""> <p class=""py-1"">Cross-Origin-Resource-Policy: same-site | same-origin | cross-origin</p> </div> </div> <p><strong>Cross-Origin-Opener-Policy (COOP)</strong><p> <div class=""px-5 mb-3""> The HTTP Cross-Origin-Opener-Policy (COOP) response header allows you to ensure a top-level document does not share a browsing context group with cross-origin documents. <p>COOP will process-isolate your document and potential attackers can't access your global object if they were to open it in a popup, preventing a set of cross-origin attacks dubbed XS-Leaks.</p> <div class=""my-2 mx-5 p-2 bg-gray-200 rounded-lg text-xs w-fit italic""> <p class=""py-1"">Cross-Origin-Opener-Policy: unsafe-none</p> <p class=""py-1"">Cross-Origin-Opener-Policy: same-origin-allow-popups</p> <p class=""py-1"">Cross-Origin-Opener-Policy: same-origin</p> </div> </div>",6.5,AV:N/AC:L/PR:N/UI:N/S:U/C:L/I:L/A:N,CWE-525: Missing HTTP Security Headers,list
Banner Grabbing,"When an HTTP response includes a server header that discloses the server software and its version, it provides attackers with valuable information about the underlying infrastructure. This disclosure can help attackers tailor their attacks to target known vulnerabilities associated with the specific server software version. Such information may include the type of server (e.g., Apache, Nginx, or IIS) and its exact version number. <p class=""pt-2"">Attackers can use this information for:</p> <ul class=""list-disc pt-1 pl-4""> <li><strong>Targeted Attacks:</strong> Knowing the server software and its version allows attackers to research known vulnerabilities and exploits specific to that version. This can lead to targeted attacks such as buffer overflow, code execution, or denial-of-service attacks.</li> <li><strong>Reconnaissance:</strong> Server header information can provide attackers with insights into the technology stack of the application, enabling them to map out the network infrastructure and identify potential attack vectors.</li> <li><strong>Fingerprinting:</strong> Attackers can use server version information for fingerprinting purposes, gathering details about the server environment to inform their attack strategies.</li> </ul>","The impact of banner grabbing can be significant, especially when attackers obtain sensitive information about a server's configuration and software versions: <ul class=""list-disc pt-2 pl-4""> <li><strong>Targeted Attacks:</strong> Banner grabbing provides attackers with details about the server's software, including type and version. Attackers can use this information to tailor their attacks to exploit known vulnerabilities specific to the server software version.</li> <li><strong>Reconnaissance and Mapping:</strong> Attackers can gather information about the server and its technology stack, aiding in reconnaissance and mapping the network infrastructure. This information can be used to identify potential attack vectors and weaknesses in the network.</li> <li><strong>Exploitation of Known Vulnerabilities:</strong> By knowing the server's software and version, attackers can look up known vulnerabilities in vulnerability databases and attempt to exploit them. This can lead to unauthorized access, data breaches, and other forms of exploitation.</li> <li><strong>Increased Risk of Other Attacks:</strong> Knowing the server's software and version can provide attackers with insights into potential weaknesses that could be exploited through other attack methods, such as cross-site scripting (XSS), cross-site request forgery (CSRF), or SQL injection.</li> <li><strong>Information Leakage:</strong> Banner grabbing may reveal other sensitive information, such as the server's operating system, configuration settings, or internal network details. This information can aid attackers in crafting more precise and effective attacks.</li> </ul>",MEDIUM,The headers revealing the server version was discovered,"To address the issue of a header revealing the server version, consider the following suggested fixes: <ul class=""list-disc pt-2 pl-4""> <li><strong>Remove or Obfuscate the Server Header:</strong> Configure the server to remove or modify the server header in HTTP responses. This can help prevent attackers from easily identifying the server software and its version.</li> <li><strong>Server Configuration:</strong> Most web servers allow you to customize or disable the server header. Refer to your server's documentation (e.g., Apache, Nginx, IIS) to configure the server appropriately.</li> <li><strong>Implement a Web Application Firewall (WAF):</strong> A WAF can help filter and block suspicious requests and responses, potentially providing an additional layer of protection and masking certain server information.</li> </ul>",5.3,AV:N/AC:L/PR:N/UI:N/S:U/C:L/I:N/A:N,CWE-213: Exposed Information through Server Headers,list
